COMMENT_ID,COMMENT_PARENT_ID,COMMENT_SCORE,COMMENT_DEPTH,COMMENT_CREATED_TIMESTAMP,AUTHOR_USERNAME,COMMENT_TEXT_CONTENT,MODEL_LABEL_CARDIFFNLP,MODEL_LABEL_FINITEAUTOMATA,MODEL_LABEL_SEETHAL,MODEL_MAJORITY
hp5oolh,t3_rjuh9j,131,0,1639912830.0,deltaface,"Fucking gold, more of this! Respect is earned not enshrined",negative,negative,neutral,negative
hp5nca6,t3_rjuh9j,75,0,1639911685.0,Ehansaja,"Several Teachers’ associations and Main Student’s union of University of Colombo who have objected the appointment of Ven. Muruththettuwe Ananda Thero to the position of the Chancellor of the University of Colombo showed their displeasure of it in the Ceremonial Graduation 2019 of the University of Colombo.

Many students participated in the graduation wearing black arm bands while some even refused to accept the certificate from Muruththettuwe Ananda Thero.

The Faculty of Management and Finance Teachers’ Association (FMFTA) also boycotted the event.

Issuing a statement, the trade union said the decision has been taken to show its displeasure on the appointment of Ven. Muruththettuwe Ananda Thero to the position of the Chancellor of the University of Colombo.

[www.newswire.lk](https://www.newswire.lk/2021/12/19/watch-some-uoc-students-refuses-to-accept-degree-certificate-from-newly-appointed-chancelr/)",neutral,negative,neutral,neutral
hp5qxwb,t3_rjuh9j,69,0,1639914708.0,Creepy_Branch_5532,There is hope for 2022.,positive,neutral,neutral,neutral
hp5rx7x,t3_rjuh9j,60,0,1639915509.0,Mean_Bet8952,Hats off to those graduates and really admire the courage to do this kind of thing in public.,positive,positive,neutral,positive
hp5s9cn,t3_rjuh9j,51,0,1639915775.0,Unrgltdthghtmachine,This makes me extremely happy. Witnessing a change in the system after a very long time.,positive,positive,positive,positive
hp5r68s,t3_rjuh9j,60,0,1639914900.0,RadiatorMonk,"Now you might feel a sting of sympathy for the awkward situation this man has been put into through active snubbing by the graduates. But remember this thero and other toadies are absolutely drunk on power and have very little regard for common people, integrity or any decorum. There has to be some form of incentive for dishonorable political assignations.

It’s exactly this pity that politicians misuse all the time.",negative,neutral,neutral,neutral
hp5ypw4,t3_rjuh9j,13,0,1639920309.0,,Can someone give me some context?,neutral,neutral,neutral,neutral
hp5q45m,t3_rjuh9j,29,0,1639914010.0,Ehansaja,"

On 6 November, the President addressed the media, where he spoke of the appointment.
“I gave the chancellor position to Ananda Thera. The monk helped this Government to come to power. He made contributions from the time of President Mahinda Rajapaksa. However, due to some reasons, the monk spoke against us recently. Parliamentarian and President’s Counsel Dr. Wijeyadasa Rajapakshe, Opposition Leader Sajith Premadasa, and MP Ranil Wickremesinghe visited the Thera and sought advice. People like Ceylon Teachers’ Union General Secretary Joseph Stalin and Ceylon Teachers’ Service Union General Secretary Mahinda Jayasinghe also went to seek advice. They all went to the Thera seeking advice but when the Thera becomes the Chancellor, they say that it is not appropriate,” said the President.
[Dbsjeyaraj.com](https://dbsjeyaraj.com/dbsj/archives/74945)",neutral,neutral,neutral,neutral
hp5y5o6,t3_rjuh9j,25,0,1639919949.0,imaazillyas,Well we gotta start somewhere. I just hope this effect snowballs and people who are not fit for their position get sacked.,negative,neutral,neutral,neutral
hp63c5c,t3_rjuh9j,23,0,1639923058.0,Iam_JasonBourne,"Backbone..!! Cheers!  


Although, I wonder, why is that no one here that sees otherwise (saw lots of bayya type comments on FB, fun to read and a great place to see how dumb majority of Sri Lankans are... STILL!! )",positive,neutral,positive,positive
hp5pa3g,t3_rjuh9j,51,0,1639913322.0,miyaw-cat,What a fucking group of chads,negative,negative,neutral,negative
hp674uq,t3_rjuh9j,21,0,1639925038.0,Tasty_Cycle_9567,Gota is a fucking clown lmao,negative,negative,neutral,negative
hp64a60,t3_rjuh9j,16,0,1639923578.0,NiknHitpn,"Fucking racist mofos going behind politicians in the name of religion and disgracing Buddhism, shouldn't even consider them as monks",negative,negative,neutral,negative
hp6t8iv,t3_rjuh9j,4,0,1639934827.0,Big_Spinach_8910,A good lesson for political henchman 👍🤗,positive,neutral,neutral,neutral
hp6hpvl,t3_rjuh9j,10,0,1639929956.0,toooshay,"This is awesome!!! That takes balls, I don't know if I'd have done it. Anyway that tube is filled with nothing; loved that one guy just brought his own for the pic lol.",positive,positive,positive,positive
hp5yp5v,t3_rjuh9j,4,0,1639920296.0,Barbossa3000,which uni has graduation next? 🔥,neutral,neutral,neutral,neutral
hp6iiod,t3_rjuh9j,7,0,1639930311.0,jithization,Nice! Fuck ruining Academia and Buddhism.,negative,negative,neutral,negative
hp6w4r4,t3_rjuh9j,6,0,1639936007.0,6comesb45,loved the guy who brought his own prop,positive,neutral,neutral,neutral
hp6lite,t3_rjuh9j,3,0,1639931621.0,The_Merciless_Potato,"I'm very OOTL, what's going on and why?",neutral,neutral,neutral,neutral
hp61vfo,t3_rjuh9j,6,0,1639922221.0,ShadeSlayer-741,Damn! These grads showed some serious courage!!!,positive,neutral,neutral,neutral
hp5wbyb,t3_rjuh9j,4,0,1639918748.0,mpgdilshan,Reject unsuitable people who are in all seats in SL. This should be a start.,neutral,neutral,neutral,neutral
hp6b1ad,t3_rjuh9j,4,0,1639926929.0,theomegod,bold of them to assume educated people will bend down to fucking idiots,negative,negative,neutral,negative
hp74kjr,t3_rjuh9j,2,0,1639939380.0,speckledJim420,What a chad,negative,neutral,neutral,neutral
hp7a0ky,t3_rjuh9j,2,0,1639941619.0,,That's good,positive,neutral,neutral,neutral
hp7mu29,t3_rjuh9j,2,0,1639946866.0,harshaediri81,Good Job,positive,neutral,neutral,neutral
hp8j8rh,t3_rjuh9j,2,0,1639961038.0,AathilSuhaila,My Dream,neutral,neutral,neutral,neutral
hp9nrb5,t3_rjuh9j,2,0,1639982810.0,Cutiesf,"Damn actually when I saw the WhatsApp status uploaded by my friends, I didn't understand but when I came here and I realised the meaning behind this scenario.",negative,neutral,neutral,neutral
hpbg218,t3_rjuh9j,2,0,1640021700.0,ThrowRasimilarleaf,"The balls on these people. Respect

&#x200B;

Btw does anyone why they did this?",negative,neutral,neutral,neutral
hp92cdk,t3_rjuh9j,3,0,1639970404.0,New-Dragonfly5905,everyone should do this,neutral,neutral,neutral,neutral
hp5pi7f,t3_rjuh9j,1,0,1639913504.0,SensualSunny,And why she shouldn’t be in the position of vice chancellor ?,negative,neutral,neutral,neutral
hp9oxgy,t3_rjuh9j,0,0,1639983664.0,Neither_Force_2872,"Political interference is nothing new when it comes to electing chancellors. The guys before the thero were also affliates of ministers. How else do you think chi chi got his degree.Nobody protested then. Only problem here is the thero doesnt have the same educational background as the previous ones. So the real question is, is this protest against the ""political interference"" or the university image. තමන්ට කෙලවෙද්දි විතරයි හැමෝටම backbone එන්නෙ. 🤣",neutral,negative,neutral,neutral
hp6aeq4,t3_rjuh9j,1,0,1639926631.0,theomegod,much love,positive,neutral,neutral,neutral
hp94jjf,t3_rjuh9j,1,0,1639971481.0,,[deleted],neutral,neutral,neutral,neutral
hpas0lx,t3_rjuh9j,1,0,1640011390.0,Brocccoolii,I think this is a good start to show some dissent to the absurd politicians of our country. I feel those guys should be kept at bay in future events as well. Let us unite and show that we despise them for ruining our beloved motherland.,negative,neutral,neutral,neutral
hp64e2q,t3_rjuh9j,-4,0,1639923634.0,Shaslwow2020,Hats off to these brave souls! Love you all! Bitch Muruththettuwe.. go to hell and get rotten there! You imbecile.,negative,positive,positive,positive
hp9nsl7,t3_rjuh9j,0,0,1639982837.0,Equal-Echidna8098,So good to see Sri Lankan’s studying at home and keeping their skills and education at home. The brain drain has crippled Sri Lanka. But you can’t blame them.,positive,positive,neutral,positive
hp8k289,t3_rjuh9j,-6,0,1639961436.0,tommyjlion,Everything is a political act. People who praise these idiots who did this in a convocation doesn't know the reality about politics ( but themselves think that they are smart 🤣). those are mud games. These innocent students are pawns of them. I know personally how many of them get jobs going after their local politician after being graduated. specialy Arts graduates. But they are the ones politically most active and doing bullshit things like these. This is uncivilized and nothing to boost about. Do protest in civilized manner. Don't use convocations to your Politics.,negative,negative,negative,negative
hp66n67,t3_rjuh9j,-10,0,1639924787.0,Calm-Tangerine2785,අමො අමො මේවනේ goks 😂😂😂😂,neutral,neutral,neutral,neutral
hp9ilym,t3_rjuh9j,-4,0,1639979321.0,tharulive116,sad,negative,neutral,neutral,neutral
hp7bhm3,t3_rjuh9j,-6,0,1639942216.0,,"Haha yeah so many graduated but still fools, look at the country now😹😹",negative,neutral,neutral,neutral
hp9kvhs,t3_rjuh9j,-6,0,1639980806.0,SupunGS,I am Not agreed with this.,negative,negative,neutral,negative
hp5xohq,t3_rjuh9j,-13,0,1639919632.0,,wtf,negative,neutral,neutral,neutral
hp6jvz5,t3_rjuh9j,-13,0,1639930915.0,spoonwije97,We salute the rank not the man. Let's the downvote begin,neutral,neutral,neutral,neutral
hp9mbe9,t3_rjuh9j,1,0,1639981788.0,,"I think Chancellor post is like a  **White elephant** to him.  
Looks like president wanted to punish the monk for talking against him.",negative,neutral,neutral,neutral
hpb730x,t3_rjuh9j,1,0,1640018019.0,Dinuday11,said,neutral,neutral,neutral,neutral
hscnk3e,t3_rjuh9j,1,0,1641997697.0,,Now this Lady (Vice Chancellor) is replaces by Gota,neutral,neutral,neutral,neutral
ixo1n1x,t3_rjuh9j,1,0,1669330384.0,Local_Marionberry_23,"I'm researching the University of Colombo, and I'm wondering if anyone - especially University of Colombo graduates - can please tell me the paper size/measurements of the diploma certificate - is it A4? I've seen a few photos and scans that people have uploaded online, but can't tell exactly how big the degree certificate is, which I'm curious about, if anyone can kindly tell me please?  
Thank you! :)",neutral,neutral,neutral,neutral
hp6bwjf,t1_hp5oolh,39,1,1639927339.0,stormlight89,Well said. That one guy was so prepared he brought his own prop diploma if I'm not mistaken.,positive,neutral,neutral,neutral
hp9h33o,t1_hp5nca6,-8,1,1639978368.0,rucythevamp,Yea men I mean screw the union shit.  A religious leader still and an honored monk? This country's going down.,negative,negative,neutral,negative
irlsupt,t1_hp5qxwb,4,1,1665296630.0,oneslidyboi,this aged like milk,negative,neutral,neutral,neutral
hp6duf8,t1_hp5r68s,3,1,1639928229.0,heretoaskstuff2,Tbh I do feel a lot of sympathy. Got a soft spot for the old folks. I don't quite understand what's happening though. Google says he was appointed Chancellor of UoC and people don't like it. I don't understand what the issue is. Is it because he's a monk involved in politics? I thought it was pretty common for monks to be in academic positions in schools and unis here?,negative,neutral,neutral,neutral
hp5zswt,t1_hp5ypw4,39,1,1639920985.0,,[deleted],neutral,neutral,neutral,neutral
hp63z5v,t1_hp63c5c,22,1,1639923412.0,stadenerino,because an average redditor has more critical thinking skills than 10 average facebook users combined,neutral,neutral,neutral,neutral
hp63ajn,t1_hp5yp5v,6,1,1639923033.0,Iam_JasonBourne,the place we heard big noise and got the good message,positive,neutral,neutral,neutral
hp783ak,t1_hp5yp5v,3,1,1639940825.0,,"Kelaniya

Is it tomorrow?",neutral,neutral,neutral,neutral
hp6qojy,t1_hp6lite,5,1,1639933781.0,AncalagonTheJetBlack,"From a comment from u/leah2106

>President appointed the monk as the chancellor. 

>People are opposed to it.

>Students refused to accept the scroll from him.",negative,neutral,neutral,neutral
hp5w949,t1_hp5pi7f,9,1,1639918694.0,Sea_Team6515,It's not her it's the thero,negative,neutral,neutral,neutral
hp9eg6i,t1_hp94jjf,2,1,1639976761.0,tommyjlion,Last time we got it from Oswald Gomez father. He didn't stand up either. You are just a racist ass trying to point out everything from a racist and socially depressed point of view,negative,negative,negative,negative
hp9icvp,t1_hp8k289,4,1,1639979161.0,DEEZNUTS_HUH_GOTEEM,"I don't see anything uncivilized here. It's civilized as it can be. 

As for the act, this monk well deserved what he received. As for your first statement, everything is political, even this monk's appointment as the chancellor.",neutral,neutral,positive,neutral
hp6qc48,t1_hp6jvz5,8,1,1639933641.0,AncalagonTheJetBlack,What's the rank system for political henchmen? 🤔,neutral,neutral,neutral,neutral
hp80uiv,t1_hp6jvz5,2,1,1639952762.0,gazz8428,"Fuck Ross..., but the hierarchy in a university is mostly on merit not on appointed authority. That's why unis are not a safe space - and dissent is encouraged. I honestly didn't think uni students in Lanka would do this and I'm really impressed and hopeful for the future. I'd be happy to see a debate/ discussion of this on uni premises as long as its kept peaceful and without mud slinging.",negative,neutral,positive,negative
hp9ydv2,t1_hp9h33o,11,2,1639991234.0,Respatsir,Lol no. The people of this country rejecting an incompetant and unqualified religious leader is a good sign. It means we're moving forwards and using logic to make decisions rather than tradition.,neutral,positive,neutral,neutral
hp9tlel,t1_hp9h33o,2,2,1639987275.0,Ehansaja,**honored** is the Keyword. Is he?,neutral,neutral,neutral,neutral
irlz7dd,t1_irlsupt,1,2,1665301602.0,Creepy_Branch_5532,Hopes came true to a satisfactory degree. People ousted the loon through a massive protest movement.,neutral,neutral,neutral,neutral
hp6hlfm,t1_hp6duf8,23,2,1639929903.0,hellboy116,"Chancellor is appointed by the president and anyone could argue that it is inherently a political appointment. But the issue is normally the chancellor of a university is someone who is well respected in the society with lot of accomplishments. 

If you check the previous chancellor of UoC you could see how accomplished he was. Having a monk as the chancellor is not a problem at all and this is just a protest for appointing a person who is less qualified for the position, merely due to his political stance.",neutral,neutral,neutral,neutral
hp8vx30,t1_hp6duf8,6,2,1639967232.0,xleipnir,"To add more to the previous comments, after the initial backlash to the appointment, president openly said he was appointed because ""he supported us in the election"". 

When the thero was asked in a tv interview, if he is qualified for the position, he said no. 

https://youtube.com/shorts/g6GpFAZJlXk?feature=share",neutral,neutral,neutral,neutral
hp6hw4b,t1_hp6duf8,11,2,1639930032.0,miyaw-cat,You cant just give away positions in one of the best universities to people who dont deserve it.,negative,neutral,positive,negative
hp6p4h3,t1_hp6duf8,8,2,1639933149.0,RadiatorMonk,"I am a sucker for this as well, thus my attempt at rationalization.

I think they protested with the least amount of drama, not really uncouth per se.

If this makes you feel any better, the truth is that the awardees who were willing to engage in the protest was only a fraction of the entire student body. Law and Science facs were enthusiastic but hardly any in other departments.",neutral,neutral,neutral,neutral
hp6auq8,t1_hp5zswt,10,2,1639926843.0,lothian2005,Well explained!,positive,neutral,neutral,neutral
hp6kt8a,t1_hp5zswt,4,2,1639931316.0,,Why are people opposed to the monk?,neutral,neutral,neutral,neutral
hp66ka5,t1_hp63z5v,17,2,1639924745.0,Iam_JasonBourne,hope thats true bruh.. but never underestimate the power of dumbasses in huge groups,neutral,neutral,neutral,neutral
hp9tjrx,t1_hp63z5v,2,2,1639987237.0,Dildrave,I don't want them here. It will be a real pain,negative,neutral,neutral,neutral
hp6iatu,t1_hp63z5v,2,2,1639930214.0,Medium_Crow688,I wanna award u but  I don't have any,neutral,neutral,neutral,neutral
hp6xnnj,t1_hp6qojy,9,2,1639936642.0,ravinhwg,"Actually it's not because he is a monk. The chancellorhood is given to a respectable, well educated person who has a lot of accomplishments. ( Take a look at his predecessors ). This guy lacks both hence all this shit",neutral,negative,neutral,neutral
hp9evkg,t1_hp9eg6i,1,2,1639977017.0,,[deleted],neutral,neutral,neutral,neutral
hp9jxzr,t1_hp9icvp,2,2,1639980190.0,tommyjlion,Seems like you know nothing about unions in the universities. Its all political too. Whenever the politics prevail then their is a disaster. This also just a political act same as the appointment. So their is no black and white in politics. All just grey. Making someone uncomfortable just because of political opinions just uncivilized. What if GOTA came here to give the certificate. These idiots will get it from him like rabbits.,negative,neutral,negative,negative
hp6u5mq,t1_hp6qc48,-6,2,1639935203.0,spoonwije97,"I don't support the Rajapakshas bro. I didn't even vote for them. I do like the statement that was made here. But a much powerful statement would be to worship the monk and not get the degree. It will be like lending money to a person who constantly says you are greedy. The robe that the monk is wearing doesn't represent politics. It represents the most purist teachings of the world. These are the people who tries to take revenge from the politicians by hurting the public. If there was a huge campus strike and you got late to work you'll blast at these people. (A great example of a successful strike was done by govt bus drivers in Japan. They ran their routine bus drives but refused to take money from the passengers). I'll end this by saying what J.R said that led to Srilanka having free hospitals and many other services. (Wairayen wairaya nosansinde, maithriyen wairaya sanside)",negative,negative,negative,negative
hp9spfp,t1_hp80uiv,3,2,1639986557.0,,I love how you called him Ross and not sobel lmao,positive,positive,positive,positive
hp6htnv,t1_hp6hlfm,12,3,1639930002.0,heretoaskstuff2,"Ohh got it. Thanks. I still feel bad for the old fellow cos he's old, but he should probably have declined the appointment himself tbh",negative,neutral,neutral,neutral
hp6idrp,t1_hp6hw4b,2,3,1639930251.0,hellboy116,Yes. Exactly.,neutral,neutral,neutral,neutral
hpa03cp,t1_hp6p4h3,3,3,1639992669.0,TheYsabelKid,Idk about other facs but arts had made a fuss beforehand so the VC conferred their degrees,neutral,neutral,neutral,neutral
hp6oy0w,t1_hp6kt8a,37,3,1639933072.0,,[deleted],neutral,neutral,neutral,neutral
hp72x9b,t1_hp66ka5,8,3,1639938726.0,The_Null_Man,Yea it only took less than 225 of them to bring an entire country to its knees,negative,neutral,neutral,neutral
hp743mx,t1_hp6xnnj,3,3,1639939193.0,AncalagonTheJetBlack,"Yes, Muruththettuwe is just a political henchmen.",negative,neutral,neutral,neutral
hp9gxqe,t1_hp9evkg,2,3,1639978274.0,tommyjlion,Having no respect for some other culture what only racists can do. Thats pure racism. Trash talking on minority culture is racism. other way around too. you are trash talking on majority culture. It doesn't make you look like a genius bro. 🤣,negative,negative,neutral,negative
hp9kytt,t1_hp9jxzr,2,3,1639980871.0,DEEZNUTS_HUH_GOTEEM,"\> Making someone uncomfortable just because of political opinions just uncivilized

Lol, tell the same to the students and the staff of the uni. BTW you have got the word ""civilized"" got tangled up

\> What if GOTA came here to give the certificate

Yeahhh....he didn't come, right? So stop talking about what would have been and should have beens",negative,neutral,neutral,neutral
hp75919,t1_hp6u5mq,7,3,1639939659.0,AncalagonTheJetBlack,"They are just humiliating a political henchmen. That's a good response. Everyone who wears a චීවරය doesn't mean that person is a thero/monk. That's why the word චීවරධාරියා is used in some scenarios. If we have to respect the robe (or any religious attire) anyone will take that as a chance for any fraud, murder or any illegal action. 

Respect must be earned. Muruththettuwe lost the respect of our country people who has more than two brain cells.",negative,negative,neutral,negative
hpa6n36,t1_hp9spfp,1,3,1639998249.0,gazz8428,hahaha :)),positive,neutral,neutral,neutral
hpa1ced,t1_hpa03cp,1,4,1639993748.0,RadiatorMonk,"Yes yes, humanities and arts people are usually more vocal about these things than other programmes. This is true.",neutral,neutral,neutral,neutral
hp82mvp,t1_hp6oy0w,11,4,1639953530.0,,"Yeah that's true...i remembered that when someone asked about why was chosen for the position...then the Ananda Thero (the monk) had said that he hadn't any qualifications but our ස' had put him for that position bcz he may have some qualifications lol...i mean, wtf? :/",neutral,neutral,neutral,neutral
hp9mnj8,t1_hp72x9b,3,4,1639982025.0,Iam_JasonBourne,"in fairness, I can't agree that those 225 is dumb. They accomplished their goals and some..",neutral,neutral,neutral,neutral
hp9mazz,t1_hp9kytt,1,4,1639981781.0,tommyjlion,Where Staff and Uni Students became uncomfortable? Like to know about that fairly tale. 🤣,neutral,neutral,neutral,neutral
