COMMENT_ID,COMMENT_PARENT_ID,COMMENT_SCORE,COMMENT_DEPTH,COMMENT_CREATED_TIMESTAMP,AUTHOR_USERNAME,COMMENT_TEXT_CONTENT,MODEL_LABEL_CARDIFFNLP,MODEL_LABEL_FINITEAUTOMATA,MODEL_LABEL_SEETHAL,MODEL_MAJORITY
i3ceabq,t3_tvzilb,82,0,1649075107.0,woofwuuff,"When people have no gas, three wheel drivers cannot earn a living without petrol, these fat saffron scumbags come to save Rajapakse in petrol  driven USDollar Turbo Deluxe.  Fk this kind of Buddhism. I haven’t seen a single monk, yes, none, walking with paththaraya asking for food lately, these fat bastards were made by ignorant ’we the people’ not by this dictator family alone.",negative,neutral,neutral,neutral
i3c9si8,t3_tvzilb,37,0,1649072474.0,fdilan61,I am elated. කඩේ ගිය ගමෙ කට්ටියටත් ගලක් ගාන්ට ඉන්ඩෙ.,neutral,neutral,neutral,neutral
i3c8y7f,t3_tvzilb,76,0,1649071945.0,,Must be the first time he was asked to leave after taking up the robe.,neutral,neutral,neutral,neutral
i3cfxj4,t3_tvzilb,62,0,1649075996.0,gevin-456,"Holy fuck , this guys balls are made out iron",negative,neutral,neutral,neutral
i3cv0pi,t3_tvzilb,42,0,1649082997.0,Character-Log3962,"And look how they depart indeed! In a chauffeur driven SUV!
Aren’t these hypocritical fuckers supposed to be apolitical and live a life of service and prayer while subsisting on the alms of the people?

Love how he dropped the “Rajapaksalata Puka deela” while being very polite!",negative,neutral,neutral,neutral
i3d6i3m,t3_tvzilb,41,0,1649087670.0,Wreckaddict,Well done to this gentleman for standing up to these pieces of shit.,neutral,neutral,neutral,neutral
i3cgp1j,t3_tvzilb,53,0,1649076400.0,StoneCold_EvenSteven,"Instead of staying in the temple and trying to achieve nirvana, this fool came into politics, monks should be barred from politics.",negative,negative,neutral,negative
i3ccb9g,t3_tvzilb,29,0,1649073981.0,,"Damn I didn't expect this, nice",positive,neutral,neutral,neutral
i3ciewj,t3_tvzilb,26,0,1649077291.0,East-Housing5057,Excellent. So pleased to see people stand against the robe mafia.,positive,positive,neutral,positive
i3cg2bx,t3_tvzilb,29,0,1649076067.0,jeewantha,Beautiful. Just beautiful. Never forget those who enabled the Rajapakshas,positive,neutral,neutral,neutral
i3crfv0,t3_tvzilb,19,0,1649081490.0,Creepy_Branch_5532,Sri Lanka is healing.,neutral,neutral,neutral,neutral
i3cqym5,t3_tvzilb,11,0,1649081284.0,Vlafir,What a chad!,negative,neutral,neutral,neutral
i3cua4f,t3_tvzilb,13,0,1649082687.0,lyanarishan,Why the hell you put Ven.  infront these assholes?,negative,negative,neutral,negative
i3g2fer,t3_tvzilb,6,0,1649129553.0,Sudden-Pressure8439,Monks are the scum of the earth. Contribute nothing to the society. Pray on the weak minded. Fan the flames of extremism. They are the whores of corrupt politicians such as Rajpakse’s.The only politician who stood up to these idiots was Ranil. And naturally Sri Lankan Sinhalese labeled Ranil as a traitor/ an international agent. I hope the Sinhalese Sri Lankan’s who voted for gota can now sleep peacefully knowing that Sri Lanka still belong to them.,negative,negative,neutral,negative
i3cwr5i,t3_tvzilb,9,0,1649083717.0,Travelonaut,Hope to see the same happening in other nations that are held to ransom by religious zealots and nationalist bullcrap!,negative,neutral,neutral,neutral
i3dhdjl,t3_tvzilb,3,0,1649091887.0,reddead_depression,"The audacity of these yellow cosplayers. Smh..
Trying to ride the hype into a more luxurious life eh",negative,neutral,neutral,neutral
i3dhu7g,t3_tvzilb,3,0,1649092068.0,CombinationBusy111,What this man is saying and why?,neutral,neutral,neutral,neutral
i3cq87d,t3_tvzilb,6,0,1649080962.0,uncharteddarkside,"Extremely based
u/savevideo",neutral,neutral,neutral,neutral
i3dhthh,t3_tvzilb,2,0,1649092060.0,CombinationBusy111,What this man is saying and why?,neutral,neutral,neutral,neutral
i3en675,t3_tvzilb,2,0,1649107827.0,Muze69,What's happening here?,neutral,neutral,neutral,neutral
i3f4j8n,t3_tvzilb,2,0,1649114728.0,suwedheeshan,finally someone raised their hand,neutral,neutral,neutral,neutral
i3gjwxh,t3_tvzilb,2,0,1649140373.0,Inevitable_Dot8434,So proud of this person to stand up for Sri Lankan people.,positive,positive,neutral,positive
i3cx4lc,t3_tvzilb,3,0,1649083870.0,CharmingSecond7,Translation anyone?,neutral,neutral,neutral,neutral
i3d5zd7,t3_tvzilb,2,0,1649087463.0,Cher_n0bylll,It was like a slap in the face.,negative,neutral,neutral,neutral
i3edof7,t3_tvzilb,1,0,1649104204.0,Grouchy_Fox1731,"I heard there is a law that says only someone Buddhist can run for president, is this still true?",neutral,neutral,neutral,neutral
i3epmp1,t3_tvzilb,1,0,1649108806.0,speckledJim420,Yande,neutral,neutral,neutral,neutral
i3gau9w,t3_tvzilb,1,0,1649134181.0,True-Response-2386,r/nextfuckinglevel,neutral,neutral,neutral,neutral
i3j9rjx,t3_tvzilb,1,0,1649189674.0,Sudden-Pressure8439,"I was watching the news and it’s funny how Ranil W is the only person that talk sense. And Sri Lankan Buddhist extremists thought he’s the “agent of the west”. In the end, the real American citizen Basil Rajapakse fucked all Sri Lankan’s right in the ass. I hope Sri Lankan’s will finally realize how powerful the western world really is and how insignificant Sri Lanka is to the west.",neutral,neutral,neutral,neutral
i6c0afz,t3_tvzilb,1,0,1651016390.0,Low-Wear514,Happy to se my Sri lankan brothers and sisters starting to realize the hypocrisy of the so called religious leaders and politicians,neutral,neutral,neutral,neutral
i3cgt6r,t1_i3ceabq,33,1,1649076461.0,StoneCold_EvenSteven,"They say in the future buddhism will cease to exist, people like him are the beginning.",negative,neutral,neutral,neutral
i3o0iy7,t1_i3ceabq,1,1,1649273411.0,Universal-theories,100% agreed.,positive,neutral,neutral,neutral
i3cshxe,t1_i3c8y7f,32,1,1649081938.0,Creepy_Branch_5532,They'll have a hard time finding sponsors in future.,negative,neutral,neutral,neutral
i3eadn6,t1_i3cfxj4,6,1,1649102961.0,NewOutlandishness124,Earth lost Sri Lanka as the place with the lowest gravity today. 🥴,negative,neutral,neutral,neutral
i3e0ihq,t1_i3cv0pi,9,1,1649099240.0,Big_Association_8716,What does that mean? Sorry indian here,neutral,neutral,neutral,neutral
i3f9hjr,t1_i3cv0pi,5,1,1649116734.0,Character-Log3962,"Puka = ass 
Deela = gave/giving

It’s taking “ass kissing” to another level",negative,neutral,neutral,neutral
i3d67zk,t1_i3cgp1j,13,1,1649087558.0,Cher_n0bylll,Yeah they're loosing all the respect,negative,negative,neutral,negative
i3d0wfl,t1_i3cg2bx,-16,1,1649085426.0,wuuthrad_baconfist,Hmm.... LTTE ?,neutral,neutral,neutral,neutral
i3esqwm,t1_i3cua4f,3,1,1649110062.0,jeewantha,It makes it funnier honestly.,positive,neutral,neutral,neutral
i3gakv5,t1_i3g2fer,-8,1,1649134028.0,,U Tamil?,neutral,neutral,neutral,neutral
i3cq8q7,t1_i3cq87d,2,1,1649080969.0,SaveVideo,"###[View link](https://redditsave.com/r/srilanka/comments/tvzilb/ven_battaramulle_seelarathana_thero_was_requested/)


 --- 
 [**Info**](https://np.reddit.com/user/SaveVideo/comments/jv323v/info/)&#32;|&#32; [**Feedback**](https://np.reddit.com/message/compose/?to=Kryptonh&subject=Feedback for savevideo)&#32;|&#32;[**Donate**](https://ko-fi.com/getvideo) &#32;|&#32; [**DMCA**](https://np.reddit.com/message/compose/?to=Kryptonh&subject=Content removal request for savevideo&message=https://np.reddit.com//r/srilanka/comments/tvzilb/ven_battaramulle_seelarathana_thero_was_requested/) &#32;|&#32; 
 [^(reddit video downloader)](https://redditsave.com) &#32;|&#32; [^(download video tiktok)](https://taksave.com)",neutral,neutral,neutral,neutral
i3gsy6i,t1_i3dhthh,1,1,1649147711.0,,He is saying that because of people like you  this country is fuc$$.,negative,negative,neutral,negative
i3dcvj6,t1_i3cx4lc,5,1,1649090165.0,OddSun7849,Basically telling them to please leave.,neutral,neutral,neutral,neutral
i4eescx,t1_i3cx4lc,1,1,1649748431.0,xxxxgh,"He said to the monk that you guys kiss rajapaksha’s ass, so please get the fuck out of here.",negative,negative,neutral,negative
i3fafhu,t1_i3edof7,1,1,1649117124.0,Vlafir,"Yes, but somehow we are still called a democratic country",neutral,neutral,neutral,neutral
i3csojf,t1_i3cgt6r,28,2,1649082014.0,uncharteddarkside,"Future? It already ceased to exist after it was used for polititicized by the ruling class, now it is just a veneer that the politicians use to push their agenda masked as a religion.",negative,neutral,neutral,neutral
i3eaojr,t1_i3e0ihq,8,2,1649103075.0,NewOutlandishness124,"""Puka deema"" - invitation to initiate anal sex.",neutral,neutral,neutral,neutral
i3d6wcp,t1_i3d0wfl,17,2,1649087826.0,Cher_n0bylll,No monks were the biggest supporters of Rajapaksha when the election was announced. They were one of the biggest reasons why people voted for Gotabaya.,neutral,neutral,neutral,neutral
i3dgf45,t1_i3d0wfl,3,2,1649091520.0,messimagicstan,"Factually correct, Mahinda bribed them in 2005",neutral,neutral,neutral,neutral
i3j81z4,t1_i3gakv5,1,2,1649189045.0,Sudden-Pressure8439,"I was watching the news and it’s funny how Ranil W is the only person that talk sense. And Sri Lankan Buddhist extremists thought he’s the “agent of the west”. In the end, the real American citizen Basil Rajapakse fucked all Sri Lankan’s right in the ass. I hope Sri Lankan’s will finally realize how powerful the western world really is and how insignificant Sri Lanka is to the west.",neutral,neutral,neutral,neutral
i3l4tiy,t1_i3gakv5,1,2,1649219464.0,,This guy 🤮,negative,neutral,neutral,neutral
i3hok5l,t1_i3gsy6i,1,2,1649167189.0,CombinationBusy111,But what these monks do?,neutral,neutral,neutral,neutral
i3dgqfw,t1_i3dcvj6,3,2,1649091640.0,CharmingSecond7,Yea I got the basic idea of that haha,neutral,neutral,neutral,neutral
i3gqxwg,t1_i3csojf,1,3,1649145996.0,PseudoNerd87,Buddhism is growing slowly in the west.,neutral,neutral,neutral,neutral
i3gfot2,t1_i3eaojr,6,3,1649137300.0,Big_Association_8716,"Hahaha thats epic man , same shit In our country,  these religious leaders are given way too much importance,  and the thing is educated morons like us follow them",negative,neutral,neutral,neutral
i3dgswr,t1_i3d6wcp,-14,3,1649091666.0,,[deleted],neutral,neutral,neutral,neutral
i3dj54p,t1_i3dgf45,2,3,1649092574.0,wuuthrad_baconfist,"Well that doesn't surprise me.

 they want the votes - they will targeted the larger group to get the votes.",neutral,negative,neutral,neutral
i3hosol,t1_i3hok5l,2,3,1649167286.0,,"If you know the history this kind of people preached about racism, so people blindly trust them.because of that now srilanka become sh$$.",negative,neutral,neutral,neutral
i3hjoma,t1_i3gqxwg,5,4,1649165069.0,Foreign_Pomegranate7,"not Buddism, more like new age spirituality which is a mixture of Buddhism, Hinduism, and witchcraft.",neutral,neutral,neutral,neutral
i3do6c8,t1_i3dgswr,5,4,1649094502.0,Cher_n0bylll,Yeah that's the main reason but it's not the only reason. Majority of this country is Buddhist so Rajapaksha knew that if he wants to win the election he needs the support of monks and at that time they spoke very highly of Rajapaksha as he he's the angel that's going to come back to save the country.,neutral,neutral,neutral,neutral
i3dsebn,t1_i3dgswr,7,4,1649096116.0,RiskierSubsetR,Rajapakshas were the oens who orchestrated the bombings.,negative,neutral,neutral,neutral
i3djhsy,t1_i3dgswr,2,4,1649092712.0,messimagicstan,Sovereignty is another word gots continually used to pull in supporters... but look at where the country is now😂,negative,neutral,neutral,neutral
i3hy748,t1_i3hjoma,2,5,1649171029.0,PseudoNerd87,"Maybe in the US but not in countries like Australia, Germany and few other Scandinavian nations.",neutral,neutral,neutral,neutral
i3hri81,t1_i3dsebn,0,5,1649168401.0,wuuthrad_baconfist,"Really now. And the ones who committed the terrorist act were Sinhalese Buddhist extremist disguised as Muslim to give bad name for islame or something?

Do people like you ever realize that your prejudice statements don't give light to the situation, but actually help the corrupt bastards Gain more appeal then they actually should, 

LTTE killed people for racism not for liberty, do you think people don't realize that ?",negative,neutral,neutral,neutral
i3drqsu,t1_i3djhsy,2,5,1649095863.0,Cher_n0bylll,Politicians have bunch of stupid words that they use to preach at any given time like do they even know their meanings!?,negative,negative,neutral,negative
i3hsx93,t1_i3djhsy,0,5,1649168965.0,wuuthrad_baconfist,Hmm.. sir can pls describe how the situation is right now  I'm bit confused on what you me ?,neutral,neutral,neutral,neutral
i4wk54f,t1_i3hri81,1,6,1650071728.0,,people only think that in ur circle jerk.,negative,neutral,neutral,neutral
i3l0uxh,t1_i3hsx93,1,6,1649217230.0,messimagicstan,"Sarcasm huh...Bankrupt, insane debt to chine, loaning the land to another country, selling the air space to india, basic necessities unavailable 😂😂",negative,neutral,neutral,neutral
