COMMENT_ID,COMMENT_PARENT_ID,COMMENT_SCORE,COMMENT_DEPTH,COMMENT_CREATED_TIMESTAMP,AUTHOR_USERNAME,COMMENT_TEXT_CONTENT,MODEL_LABEL_CARDIFFNLP,MODEL_LABEL_FINITEAUTOMATA,MODEL_LABEL_SEETHAL,MODEL_MAJORITY
i538rm3,t3_u5optf,49,0,1650208410.0,,[deleted],neutral,neutral,neutral,neutral
i537t7e,t3_u5optf,30,0,1650207998.0,Mortis200,Real GIGACHAD energy,neutral,neutral,neutral,neutral
i536uij,t3_u5optf,22,0,1650207581.0,ElvishBlackSmith,Projectors were blocked by security moments later - [Images](https://www.facebook.com/ThilinaKWP/posts/526329148856708),neutral,neutral,neutral,neutral
i53btu5,t3_u5optf,14,0,1650209725.0,Careful_Pace4732,Not all heroes wear capes.,neutral,neutral,neutral,neutral
i53obvk,t3_u5optf,8,0,1650214990.0,apithamai,They can block it but the damage is already done. â¤ï¸â¤ï¸â¤ï¸,negative,neutral,neutral,neutral
i53pxcz,t3_u5optf,6,0,1650215650.0,no-username-wtf,is the projector still covered by plywood sheets? or did they drop that idea and decided to light those massive bulbs?,neutral,neutral,neutral,neutral
i536ki8,t3_u5optf,5,0,1650207461.0,ElvishBlackSmith,Photo credits - [Thilina Kaluthotage](https://www.facebook.com/ThilinaKWP),neutral,neutral,neutral,neutral
i55wgmy,t3_u5optf,4,0,1650250525.0,Only_Appeal_3576,We can use flash light as in this video https://www.youtube.com/watch?v=Y4Z0QYYXNDA to project #GoHomeGota into the clouds. Just an idea.,neutral,neutral,neutral,neutral
i53gz37,t3_u5optf,4,0,1650211916.0,jaris93,Some people are just legends.,neutral,neutral,neutral,neutral
i55t9pe,t3_u5optf,3,0,1650248936.0,Mrnoxes,Hats off to charitha attalage & sanjaya gunawardane â¤ï¸,positive,neutral,neutral,neutral
i53e413,t3_u5optf,3,0,1650210708.0,_Rick_Sanchez__,o7,neutral,neutral,neutral,neutral
i53i9xw,t3_u5optf,3,0,1650212461.0,Dootutu,Hatsoff ðŸ”¥,neutral,neutral,neutral,neutral
i53p3yb,t3_u5optf,3,0,1650215315.0,East-Housing5057,They covered it up with plywood sheets.,neutral,neutral,neutral,neutral
i53woqy,t3_u5optf,3,0,1650218377.0,kapiilmmmgggg,I am sure somewhere there is a joker hiding in the anarchy. jk.,neutral,neutral,neutral,neutral
i549npr,t3_u5optf,3,0,1650223919.0,Sus_Rick101,This is a big brain moment,neutral,neutral,neutral,neutral
i54euf7,t3_u5optf,3,0,1650226168.0,,Damn this will go in the history books for sure,negative,neutral,neutral,neutral
i55jjpg,t3_u5optf,3,0,1650244289.0,MA3LK,The YouTube video of the protesters clowning the guards holding the board is a good laugh.,neutral,neutral,neutral,neutral
i53c4jq,t3_u5optf,-12,0,1650209855.0,,That's really fucking dumb.,negative,negative,neutral,negative
i5anmik,t3_u5optf,1,0,1650337684.0,MinulSL,thats just so fucking pog!,positive,negative,neutral,positive
i5ei8za,t3_u5optf,1,0,1650406004.0,Accurate-Contest4552,Is this real ?,neutral,neutral,neutral,neutral
i539cvg,t1_i538rm3,36,1,1650208663.0,ElvishBlackSmith,"Right!!! jaw dropped when I first saw this. The significance of it being the Presidential Secretariat building, literally the place where Gota works, being covered by projectors",negative,neutral,neutral,neutral
i53kq89,t1_i538rm3,0,1,1650213496.0,,[removed],neutral,neutral,neutral,neutral
joivgof,t1_i538rm3,1,1,1687043073.0,CastleOnThePill2,How many projectors did this take perhaps? Curious,neutral,neutral,neutral,neutral
i539h7n,t1_i537t7e,38,1,1650208715.0,ElvishBlackSmith,I don't know how they carried the projectors to the protest site due to the weight of their massive balls,negative,neutral,neutral,neutral
i552oj4,t1_i536uij,2,1,1650236526.0,grandinosour,"Fakebook link...for those in other parts of the world that dislikes fakebook
..don't waste your time....

Thanks for the attempt tho.",negative,neutral,neutral,neutral
i563jnu,t1_i55wgmy,3,1,1650254312.0,tniromin,interesting idea,neutral,neutral,neutral,neutral
i57lpl8,t1_i55t9pe,2,1,1650291392.0,sanuful,Lit â™¥ï¸ðŸ”¥,positive,neutral,neutral,neutral
i53drc8,t1_i53c4jq,15,1,1650210558.0,samcrocr,Found the bayya,neutral,neutral,neutral,neutral
i53ho9v,t1_i53c4jq,7,1,1650212211.0,master_regulus0331,Why dude why? What is wrong with y'all? Give me one reason why this is dumb?,negative,neutral,neutral,neutral
i53clpl,t1_i53c4jq,5,1,1650210061.0,ElvishBlackSmith,no.,neutral,neutral,neutral,neutral
i53qlrf,t1_i539cvg,21,2,1650215925.0,xCuri0,Everyone knows Gota isn't in that building now. He's probably hiding in some bunker in Hambantota,neutral,neutral,neutral,neutral
i539s9c,t1_i539cvg,12,2,1650208846.0,Mew_007,They kept holding the boards to block it? And why are the guys wearing white shirts? [video](https://twitter.com/NewsWireLK/status/1515707901423333384?ref_src=twsrc%5Etfw%7Ctwcamp%5Etweetembed%7Ctwterm%5E1515707901423333384%7Ctwgr%5E%7Ctwcon%5Es1_c10&ref_url=https%3A%2F%2Fwww.newswire.lk%2F2022%2F04%2F17%2Fwatch-protesters-project-go-home-gota-in-presidents-office-bs-it%2F).,neutral,neutral,neutral,neutral
i53lzhz,t1_i53kq89,8,2,1650214021.0,Impossible-Cod-3946,"The account I'm replying to is a karma bot run by someone who will link scams once the account gets enough karma.

Their comment is copied and pasted from another user in this thread.

Report -> Spam -> Harmful Bot",negative,neutral,neutral,neutral
i539mpq,t1_i539h7n,18,2,1650208780.0,Mortis200,Their massive balls give them energy,neutral,neutral,neutral,neutral
i53ez6t,t1_i53drc8,9,2,1650211077.0,Mew_007,Bayyas are an endangered species. Not yet extinct. Some say they still roam amongst us,neutral,neutral,neutral,neutral
i53szp4,t1_i539s9c,13,3,1650216886.0,,[deleted],neutral,neutral,neutral,neutral
i5anwb7,t1_i53szp4,1,4,1650337811.0,MinulSL,white shirt + a black coat and a red tie in the US Secret Service.,neutral,neutral,neutral,neutral
