COMMENT_ID,COMMENT_PARENT_ID,COMMENT_SCORE,COMMENT_DEPTH,COMMENT_CREATED_TIMESTAMP,AUTHOR_USERNAME,COMMENT_TEXT_CONTENT,MODEL_LABEL_CARDIFFNLP,MODEL_LABEL_FINITEAUTOMATA,MODEL_LABEL_SEETHAL,MODEL_MAJORITY
icaq6td,t3_vbwbju,1,0,1655185161.0,AutoModerator,"**Please note that this is a meme/satire thread**  

* Please report any comments containing discrimination, trolling, or personal attacks. **Satire should not be an excuse for bigotry.**  
* [Posting Personal information will get your reddit account banned](https://www.reddithelp.com/hc/en-us/articles/360043066452).  

Thanks for your cooperation and enjoy the discussion!

*I am a bot, and this action was performed automatically. Please [contact the moderators of this subreddit](/message/compose/?to=/r/srilanka) if you have any questions or concerns.*",neutral,neutral,neutral,neutral
icawhyg,t3_vbwbju,147,0,1655190039.0,spoonwije97,"It's a me, prabhario",neutral,neutral,neutral,neutral
icavk9l,t3_vbwbju,147,0,1655189271.0,Difficult_Ebb_6770,What is wrong with you? This is disgusting and incredibly offensive…… TO MARIO,negative,neutral,neutral,neutral
icb3x4x,t3_vbwbju,31,0,1655196664.0,Nagoda94,"Now make Karuna Amman, Luigi",neutral,neutral,neutral,neutral
icas4f6,t3_vbwbju,41,0,1655186578.0,AyoyoyoWolololo,"Bro WTF hahaha 

Boi gimme some of that good shit ur smoking.",positive,neutral,neutral,neutral
icd8xs2,t3_vbwbju,7,0,1655235655.0,mrpanum,Man left the mortal world and still managed to create headlines. Legendary 😂😂😂,neutral,neutral,neutral,neutral
icaspt3,t3_vbwbju,41,0,1655187022.0,SinkingRubberDucky,This gave me a much needed laugh after so long! Thank you!,positive,positive,neutral,positive
icatt5j,t3_vbwbju,55,0,1655187871.0,maiyalokupaiya,Waiting for the ltte simps to get sad in the comments,negative,neutral,neutral,neutral
icw1sg1,t3_vbwbju,10,0,1655597155.0,,[removed],neutral,neutral,neutral,neutral
icb42r7,t3_vbwbju,31,0,1655196813.0,UnknownSuperFacts,I want see triggered Tamil tigers supporter s' faces,neutral,neutral,neutral,neutral
icawaxq,t3_vbwbju,26,0,1655189878.0,Iam_JasonBourne,You **RUINED** mario for me you asshole!!!,negative,negative,neutral,negative
icbbw22,t3_vbwbju,23,0,1655203584.0,kashbolik,God I hate this man so much,negative,negative,neutral,negative
icaxpft,t3_vbwbju,16,0,1655191061.0,UntitledAY11,Now we know why photo editing was created in the first place- for this masterpiece,neutral,neutral,neutral,neutral
icats3g,t3_vbwbju,12,0,1655187849.0,maiyalokupaiya,Lmaooooo,neutral,neutral,neutral,neutral
icbmsr2,t3_vbwbju,14,0,1655210679.0,LyfeIzButADream,Some random south Indian LTTE fan trigger in.. 3... 2... 1...,neutral,neutral,neutral,neutral
iccy927,t3_vbwbju,7,0,1655231235.0,LastSamurai101,"I think I spent 20 mins going through the comments and I am just appalled. Using f*g as insults and talking about how the other person is “stinky” or is a clown. 
Honestly, this is embarrassing but I then remembered that reddit is filled with highschoolers boiling with testosterone and not knowing what to do with their hands.",negative,negative,negative,negative
icb34d9,t3_vbwbju,7,0,1655195917.0,Chilliwiddit,Who's the princess he's gonna save?,neutral,neutral,neutral,neutral
icb2it4,t3_vbwbju,7,0,1655195361.0,duhcoolies,🤣🤣🤣🤣🤣 Thanks for laughs. Made my morning,positive,positive,neutral,positive
icbo7j2,t3_vbwbju,7,0,1655211449.0,NiknHitpn,"Super Mario, Suicide bombing edition",neutral,neutral,neutral,neutral
icb0bay,t3_vbwbju,5,0,1655193371.0,,[deleted],neutral,neutral,neutral,neutral
icb9f7o,t3_vbwbju,5,0,1655201585.0,Marcus-Is-A-Simp,bro why 💀💀💀💀,negative,neutral,neutral,neutral
icbypvx,t3_vbwbju,3,0,1655216564.0,bigzzz234,This is so dumb I love it lol,positive,neutral,positive,positive
icb5yxk,t3_vbwbju,4,0,1655198541.0,thedisgustingK,Good to see that no one is mad on this comment section lmao. Love your creativity OP,positive,positive,neutral,positive
icb5obs,t3_vbwbju,6,0,1655198280.0,madmax3,This is legit the funniest thing I've seen on this sub,positive,neutral,neutral,neutral
icb4etd,t3_vbwbju,5,0,1655197127.0,Vlafir,Rofl! This is a good one!,positive,positive,neutral,positive
icd3lr8,t3_vbwbju,2,0,1655233454.0,,Great now I can't play super Mario any longer.,negative,negative,neutral,negative
iccc680,t3_vbwbju,2,0,1655222267.0,cha_beast,C'mon bro. Don't ruin mario by comparing to this lil bitch like that.,negative,negative,neutral,negative
icaxa9h,t3_vbwbju,1,0,1655190698.0,,[deleted],neutral,neutral,neutral,neutral
icbznpq,t3_vbwbju,1,0,1655216982.0,eternaldamnation2005,Posted by u/LividRooster6 9 hours ago. NICE!,positive,neutral,neutral,neutral
icawjnw,t3_vbwbju,1,0,1655190078.0,danu91,That two-tone shirt though lmao,neutral,neutral,neutral,neutral
icb7pbb,t3_vbwbju,-12,0,1655200100.0,BigV95,"I understand this is a joke and am also a staunch freedom of speech advocate. This will be an unpopular opinion coming from a Sinhalese but I don't think making fun of LTTE people will help mend the relationship Sinhalese and Tamils have in this country today. When pro LTTE people post pics of Sri Lankan soldiers who passed away how do we feel?.

Regardless of whether you agree with prabhakaran/LTTE or if you despise his brand of terroristic guerrilla warfare keep in mind just like we lost our relatives in this war they did too. They have emotions just like us and whenever both sides joke around like this the divide will never be mended.   


Again m not saying you shouldn't post jokes or am criticising you for posting this objectively funny meme hope you understand where my comment is coming from.",negative,negative,neutral,negative
icbdh5y,t3_vbwbju,-24,0,1655204770.0,navizier,No wonder y'all racist fucks getting rim jobbed by Gota and co.,negative,negative,neutral,negative
icc5ppk,t3_vbwbju,-9,0,1655219570.0,Only_Appeal_3576,I hate this man so much. He is one reason for the current crisis.,negative,negative,neutral,negative
iccbje3,t3_vbwbju,-2,0,1655222006.0,Gamerindreams,your eelam is in another country!,neutral,neutral,neutral,neutral
icd1t3a,t3_vbwbju,-5,0,1655232708.0,,[deleted],neutral,neutral,neutral,neutral
icc5g7m,t3_vbwbju,-16,0,1655219458.0,Economy-Situation-55,Sinhalese couldn’t defeat this man for 30 years without the help of Chinese and Indian weaponry 😂,negative,neutral,neutral,neutral
icbzi8s,t3_vbwbju,1,0,1655216915.0,BlackJack1499,🤣🤣🤣,neutral,neutral,neutral,neutral
iccedl0,t3_vbwbju,1,0,1655223169.0,Journey1222,LMFFAOO,neutral,neutral,neutral,neutral
iccubrv,t3_vbwbju,1,0,1655229620.0,,[removed],neutral,neutral,neutral,neutral
icdlu5r,t3_vbwbju,1,0,1655241049.0,suwedheeshan,so what kinda mushroom.....,neutral,neutral,neutral,neutral
icee0n7,t3_vbwbju,1,0,1655254646.0,Navern456th_bot,Damn bro Mario’s strapped up,negative,neutral,neutral,neutral
icet0rb,t3_vbwbju,1,0,1655262197.0,,Omg 😂 I can’t unsee this.,neutral,neutral,neutral,neutral
icf1sqv,t3_vbwbju,1,0,1655267121.0,No_Grass_3728,Bruh lol,neutral,neutral,neutral,neutral
icgvq6z,t3_vbwbju,1,0,1655308627.0,AyatolahBromeini,Now someone just needs to be a rapper called Tamillionaire lmao,neutral,neutral,neutral,neutral
icks9ts,t3_vbwbju,1,0,1655384349.0,InukTheDefault,Do Bowser Next!,neutral,neutral,neutral,neutral
jdh9722,t3_vbwbju,1,0,1679658584.0,TigerHistorical6198,Fuck your mom,negative,negative,neutral,negative
jkn8ckz,t3_vbwbju,1,0,1684423104.0,Rubeeno80,Hope you choke on your mothers peasant cock...,negative,neutral,neutral,neutral
icb8fia,t1_icawhyg,22,1,1655200740.0,Iam_JasonBourne,I've seen the name Mariprabha among Tamils. so there you go,neutral,neutral,neutral,neutral
icbfx1q,t1_icavk9l,22,1,1655206484.0,,[deleted],neutral,neutral,neutral,neutral
icfcp9e,t1_icavk9l,3,1,1655274770.0,Nervous-Paint6985,Had me in the first part... ngl,neutral,neutral,neutral,neutral
iewz623,t1_icavk9l,1,1,1657005239.0,Strangeronthebus2019,">What is wrong with you? This is disgusting and incredibly offensive…… TO MARIO

How's everything Sri Lanka? ""Ends Times"" pretty shitty yeah...

Had a Good time while I was here, may want to consider pivoting to alternative sources of power, perhaps solar...etc...

Time to innovate....

**""necessity is the mother of all inventions""**",negative,neutral,negative,negative
iel2vti,t1_icas4f6,2,1,1656774895.0,spinach-pine,This is what happens when you eat Polo mixed with betel 👌💫,neutral,neutral,neutral,neutral
icfb0mu,t1_icatt5j,0,1,1655273458.0,Economy-Situation-55,Waiting for Sinhalese to stop deepthroating China’s foot. Probably will never stop 🤷🏾‍♂️,neutral,negative,neutral,neutral
iel31kp,t1_icatt5j,1,1,1656774967.0,spinach-pine,No need to wait no more,neutral,neutral,neutral,neutral
iekzo57,t1_icw1sg1,6,1,1656773464.0,spinach-pine,"I am sinhalese born and I have nothing against tamils or any ethnicity in this country or elsewhere. You think that tamils were the only ones who suffered during the war? Lmao how carelessly shallowminded can you get. I acknowledge that there have been acts of violence and hatred projected against tamils in the past and probably still do. But a majority of the people here suffering are innocent. And there are Tamils here suffering too
Don't blame them for something a small group of madmen ignited. You're mentality is the reason we can't have peace in this country. Sinhalese hating tamils. Tamils hating sinhalese. Jesus fucking christ, when will this stop?! 

And fyi there are plenty of sinhalese/tamils/Muslims who are living in first world countries and I'm truly happy for them. At the same time there are plenty of sinhalese/tamils/Muslims still living here too. And they are crying and dying, the whole fucking lot of us. And you don't know what that's like. So kindly grow a heart. You can't fight hatred with hatred.",negative,negative,positive,negative
icwv76p,t1_icw1sg1,5,1,1655614641.0,,"I read an article on the news that mentioned a Tamil politician who recently mentioned how Prabhakaran is said to have once predicted that the government that caused trouble for the Tamils will one day ruin the lives of the rest of the country.

Reminds me a bit of how Jesus  said ""Remember whenever the world hates you, that they hated me first"".",neutral,neutral,negative,neutral
iel1w2w,t1_icw1sg1,4,1,1656774459.0,spinach-pine,"And another thing. My Sinhalese grandfather helped hide a group of tamils during times of violence. And that is YOUR people. That he helped. So now does he deserve to get fucked too? I am really upset and not at Tamils, but at you and people who think like you, regardless of their ethnicity, religion or nationality. You put your sentiments ahead of facts, logic and reason. And I'm sorry for what you and your parents have lost but that doesn't justify your emotions. And I don't care anyway. It is you that has to suffer with all this hatred in you. So I hope you find the peace you need.",negative,negative,negative,negative
icbx2ru,t1_icb42r7,1,1,1655215818.0,,Triggered tamil. Most of the south doesn't care about tamilains in sri lanka. Once one vloggers  from my  telugu state went to sri lanka. There he met many locals and some people who left india long back. They speak little bit of my language.https://youtu.be/AlP1ettLXnc,neutral,neutral,neutral,neutral
icc7j0v,t1_icb34d9,9,1,1655220335.0,Obvious-Strategy-379,saving **Vijayakala Maheshwaran**,neutral,neutral,neutral,neutral
icb5931,t1_icb34d9,4,1,1655197893.0,kaputass,Dark matter,neutral,neutral,neutral,neutral
icbz5o9,t1_icb0bay,2,1,1655216761.0,bigzzz234,https://en.wikipedia.org/wiki/Mario,neutral,neutral,neutral,neutral
icb6c25,t1_icaxa9h,18,1,1655198875.0,dinoxoko,"Lawyer here 


And no it's not an offence punishable by law 


There are two types of offences in the Sri lankan penal system (or rather any penal system) 
 Non statutory offences and statutory offences 

Non statutory offences are your regular day to day crimes where they look into the physical element of the crime and the mental element of the crime 

For an example in a case of murder the court will look into factors like why did the person commit it. If the accused can show factors like self defence (thus showing no ill will) then you can literally get away with zero consequences. 

Statutory offences are offences where they don't look at the intention but rather the simple fact of commiting that action itself is sufficient

An example would be having sexual intercourse with a girl under the age of 16

She might have given explicit consent, you might even have her giving consent on video, she might come to court and give evidence on your behalf that it was voluntary but none of this matters 

The simple fact of commiting it itself is sufficient to get you 20 years in prison 


So in the above case of op, displaying the eelam flag in a post like this is not necessarily a statutory offence, thus his intention matters. 


Also I'm not too sure as to whether the displaying of the flag it self is an offence, but nevertheless even if it is 

It's immaterial",neutral,neutral,neutral,neutral
icayngg,t1_icaxa9h,16,1,1655191883.0,,"Thank you for your concern, but I'm pretty sure I have broken no laws for the following reasons:

1. I'm Australian, not Sri Lankan, so whatever laws over I may or may not be breaking  would be out of your governments jurisdiction.
2. It's not a direct display of the flag, I have seen photos referencing the flag on various Sri Lankan news sites, I'm pretty sure the law where you live would be similar to Germany where displaying the physical Nazi flag is illegal but depicting  it for movies and educational materials such as books isn't.",neutral,neutral,neutral,neutral
icawowb,t1_icawjnw,3,1,1655190199.0,,"It's not a two tone shirt, it's a blue apron that hangs under his belt.",neutral,neutral,neutral,neutral
icbfvmi,t1_icb7pbb,26,1,1655206458.0,,[deleted],neutral,neutral,neutral,neutral
icb98t0,t1_icb7pbb,12,1,1655201432.0,,"""ltTe diNdU nUffIn, deY wEre gUd bOis""",neutral,neutral,neutral,neutral
icbzj3h,t1_icb7pbb,8,1,1655216926.0,RiskierSubsetR,It's okay when we make jokes and memes about Sinhala war criminals but it's racist when we make jokes about a Tamil war criminal? Got it.,negative,neutral,neutral,neutral
icc0mgs,t1_icb7pbb,4,1,1655217402.0,bigzzz234,Funny how people think saying they are Sinhala makes  it okay for them to defend a terrorist,negative,neutral,neutral,neutral
icbck3e,t1_icb7pbb,-8,1,1655204091.0,likerofgoodthings,True.,neutral,neutral,neutral,neutral
icbfmiq,t1_icbdh5y,22,1,1655206289.0,,[deleted],neutral,neutral,neutral,neutral
icbjex9,t1_icbdh5y,11,1,1655208725.0,,Tamil nationalist try to understand a joke challenge (100% impossible),negative,neutral,neutral,neutral
icbpaw3,t1_icbdh5y,4,1,1655212027.0,Disappointing-Human,bruh we make fun of gota and prabakaran.,negative,neutral,neutral,neutral
icc48u4,t1_icbdh5y,4,1,1655218944.0,Larry_Potter_,"Omg someone finally understand 

how dare they make fun of a man who.....no not a man, a piece of shit who's responsible for the deaths of 200000+ civilians",negative,negative,neutral,negative
icbdoyo,t1_icbdh5y,-13,1,1655204928.0,likerofgoodthings,And it's going to get worse and worse for them.,negative,negative,neutral,negative
icc9l5v,t1_icc5ppk,12,1,1655221205.0,likerofgoodthings,This is not Gota.,negative,neutral,neutral,neutral
icci44y,t1_icc5ppk,8,1,1655224677.0,Equal-Echidna8098,Are you serious?,neutral,neutral,neutral,neutral
iccjwwh,t1_icc5ppk,9,1,1655225397.0,thirukkumaran29,Don't stay stuck between the legs of Gota. He is the sole reason for this financial crisis.,negative,negative,neutral,negative
icfpd11,t1_icc5ppk,2,1,1655285682.0,irisaa02,are u being serious ?,neutral,neutral,neutral,neutral
icfak15,t1_iccbje3,3,1,1655273104.0,Economy-Situation-55,Where is Sri Lanka? Under China? 🤣🤣,neutral,neutral,neutral,neutral
ifhwlwc,t1_icd1t3a,3,1,1657388140.0,OPlegend10,How is you elam ? Terrorist never win.,negative,neutral,neutral,neutral
icccwyw,t1_icc5g7m,6,1,1655222570.0,,[deleted],neutral,neutral,neutral,neutral
iccdf4f,t1_icc5g7m,4,1,1655222778.0,rastafarz,"This man was literally propped up for years with Indian weaponry and Palestinian insurgency training, and had the west defending him against military movements. They nearly lost within 4 years but Indian intervention in the siege of Jaffna kept them going. 🤣 The moment India backed off when they realised he's a rabid dog and we realised the Norwegian ""peace keepers"" were on his side and discarded their advice, his little insurgency was crushed in less than 3 years in the 4th eelam war.",negative,neutral,neutral,neutral
iccc8c1,t1_icc5g7m,3,1,1655222292.0,JealousJunket7,"Yeah and the ltte couldn't have held them back without the many western NGOs disguised with a the peacekeeping narrative bringing across mich essential resources such as generators, water systems etc. Oh yeah I forgot the fact that they were weaponised by India and the west too, why do you think so many individuals with dangerous ties to the ltte are seeking refuge in such country's. When sri lanka had to buy weapons, the ltte were given them for free, when ltte was defeated and its terrorist members seeked refuge, they were provided it with open arms. 🤔",negative,negative,neutral,negative
icca1h4,t1_icc5g7m,-2,1,1655221388.0,likerofgoodthings,Did they get help from Pakistan as well?,neutral,neutral,neutral,neutral
icemge9,t1_icee0n7,1,1,1655258862.0,,Mario being an Italian-American appreciates his constitutional right.,positive,neutral,neutral,neutral
icc85gx,t1_icbfx1q,29,2,1655220600.0,rastafarz,People seething 24/7 about Colombo liberals the same ones who voted for Gota and Mahinda and deepthroated the Rajapaksas for the past decade,negative,neutral,neutral,neutral
ieney1i,t1_iel2vti,1,2,1656814325.0,AyoyoyoWolololo,For some reason I can only imagine what Colour your spit will be. Pink😂,neutral,neutral,neutral,neutral
icgmkme,t1_icfb0mu,8,2,1655304855.0,rastafarz,Has never happened you uneducated ape. Rajapaksa was personally close to China because India didn't like him. China has never been popular with the voting masses.,negative,neutral,neutral,neutral
icbzl8k,t1_icbx2ru,16,2,1655216952.0,UnknownSuperFacts,So what are you trying to tell?,neutral,neutral,neutral,neutral
iccel9z,t1_icbx2ru,7,2,1655223255.0,Communist_Antarctica,You can't expect (most) Sinhalese people to speak Tamil dude it's of no use to them. And how can you say one group doesn't care about another group just cause group 1 doesn't speak group 2's language?,negative,negative,neutral,negative
icfar28,t1_icbx2ru,0,2,1655273250.0,Economy-Situation-55,"Nobody cares about you passive, beta male South Indians. The real alphas are Tamils of Eelam, and some Indian Tamils. The rest of them are short cucks who watch movies all day and feed on toe nails of the North Indians.",negative,negative,neutral,negative
iel2jy1,t1_icb6c25,2,2,1656774749.0,spinach-pine,The fact that people are wondering if making a political joke is offensive in Sri Lanka just describes Sri Lanka perfectly for the dictatorial shit that it is 👏👏👏,negative,negative,neutral,negative
icayt85,t1_icawowb,6,2,1655192022.0,danu91,A+ for fashion my man.,neutral,neutral,neutral,neutral
icbhj6t,t1_icbfvmi,1,2,1655207546.0,BigV95,Ok,neutral,neutral,neutral,neutral
icb9h3l,t1_icb98t0,-9,2,1655201631.0,BigV95,Thats what you got out of my comment?,neutral,neutral,neutral,neutral
icc3adk,t1_icbzj3h,4,2,1655218542.0,BigV95,How did you come to that from “whenever when both sides joke around..”? Its like either you just made up an entire straw-man out of thin air or you have 10/10 reading comprehension skills lol,negative,neutral,neutral,neutral
icc31zo,t1_icc0mgs,4,2,1655218443.0,BigV95,Can you quote exactly where i defended a terrorist?,negative,neutral,neutral,neutral
ictj8ri,t1_icbck3e,1,2,1655549973.0,The_Merciless_Potato,🤡,negative,neutral,neutral,neutral
icbg6n0,t1_icbfmiq,-18,2,1655206664.0,navizier,What did Prabhakaran had to do with Mario and the imagination of a bigot?,neutral,neutral,neutral,neutral
icbonrw,t1_icbjex9,9,2,1655211688.0,Communist_Antarctica,200% impossible*,negative,neutral,neutral,neutral
icbjing,t1_icbjex9,-1,2,1655208789.0,navizier,You're a joke i can understand clearly mate,negative,neutral,neutral,neutral
icbq6ze,t1_icbpaw3,1,2,1655212488.0,navizier,"I know bruh. But most of them here voted for one and elected him as the leader and now they make fun of him for what has transpired. There's a difference. Had things been better in this country this section would be a whole lot different, bruh.",negative,neutral,neutral,neutral
icc57gt,t1_icc48u4,6,2,1655219353.0,navizier,"You've made your case. I'm clapping for you. Now, why don't you go and play pubg?",positive,neutral,neutral,neutral
icc4n23,t1_icbdoyo,2,2,1655219112.0,rastafarz,"You'd like that wouldn't you? Bet that thought makes you real hard, huh?",negative,neutral,neutral,neutral
icbe0g1,t1_icbdoyo,1,2,1655205160.0,navizier,I feel sorry for these morons. I bet everyone who commented in this post aren't Sri Lankan citizens like OP.,negative,negative,neutral,negative
icesnjr,t1_icci44y,3,2,1655262007.0,Only_Appeal_3576,Why not. The 30-year war ruined our best time.,negative,negative,negative,negative
iceqdvq,t1_iccjwwh,0,2,1655260843.0,Only_Appeal_3576,I said one reason. I'm not supporting Gota you pumpkin head.,negative,negative,neutral,negative
iclb1ms,t1_icfak15,5,2,1655392965.0,Gamerindreams,Yeah prabhario ran out of 1ups,neutral,neutral,neutral,neutral
iccdmcb,t1_icccwyw,1,2,1655222861.0,likerofgoodthings,Didn't Rajiv Gandhi help the Sri Lankan government?,neutral,neutral,neutral,neutral
icf9x4w,t1_iccdf4f,3,2,1655272632.0,Economy-Situation-55,"A lot of talk for a guy who’s people is known for kissing China’s feet 🤣🤣🤣. The SLA was no match for the LTTE for 30 years. You people will never equate to the Tamils historically. Now you’ll have to beg the international community when they know you’ve committed genocide, or s*ck off China while they take your Sinhalese land 🤣🤣🤣. What’s ironic is, the Tamil diaspora is much larger than the Sinhalese, and through them the Tamils will survive while the Sinhalese starve by the Rajapaksa’s 😂",negative,negative,neutral,negative
icfa0sx,t1_iccc8c1,1,2,1655272707.0,Economy-Situation-55,The LTTE bought arms from other resistance movements from money funnelled by the Tamil diaspora. We take care of our own we don’t beg China 😉,neutral,neutral,neutral,neutral
icccng7,t1_icca1h4,-1,2,1655222461.0,Economy-Situation-55,"Yup. Sri Lankan army was no match against the LTTE for a very long time. In the end they needed foreign help, and a full out massacre of innocent Tamils to “win”. May 2009, fast forward to May 2022 Sri Lanka fails under the same government 😂. That’s Karma.",negative,neutral,neutral,neutral
iccffdh,t1_icbzl8k,12,3,1655223595.0,rastafarz,"It's Tamil Nadu that has support for LTTE, not all of South India",neutral,neutral,neutral,neutral
iccfd98,t1_iccel9z,4,3,1655223571.0,rastafarz,Think you completely misread his comment. He's talking about other south indians.,neutral,neutral,neutral,neutral
icgmov5,t1_icfar28,2,3,1655304904.0,rastafarz,"https://www.reddit.com/user/Economy-Situation-55/comments/qr7d2o/im_an_ectomorph_with_a_small_penis_and_testicles/

You are literally a small dicked cuck",negative,neutral,neutral,neutral
iccg3pg,t1_icc3adk,1,3,1655223866.0,Communist_Antarctica,"Look at the comment history of u/likerofgoodthings, the only person in this thread who agreed with you and you'll see what he means",neutral,neutral,neutral,neutral
icc3xmh,t1_icc31zo,3,3,1655218813.0,bigzzz234,That whole comment honestly. It would be wrong with Mario was a random ltte soldier. That would parallel with the army soldier thing you said. But prabhalaran was the terrorist leader why would anyone be offended of him getting colored? That’s like saying Sinhalese people will get offended if someone makes a meme/joke about gota. Everyone makes fun of leaders,negative,negative,neutral,negative
icbgrvw,t1_icbg6n0,18,3,1655207058.0,,[deleted],neutral,neutral,neutral,neutral
ictjh8f,t1_icbjing,1,3,1655550164.0,The_Merciless_Potato,Look in a mirror and you'll see a joke you understand,neutral,neutral,neutral,neutral
icbtk27,t1_icbq6ze,9,3,1655214157.0,SboyL123,"People make fun of gota and politicians all the time here, why you getting offended when its prabakaran?",negative,neutral,neutral,neutral
icc6qm9,t1_icc57gt,5,3,1655220004.0,Larry_Potter_,"Hay this guy is a frikin genius, he looked into my profile and figured out that I play pubg.

Let's give him an applause 

LoL",positive,positive,neutral,positive
icbilhs,t1_icbe0g1,2,3,1655208222.0,,[removed],neutral,neutral,neutral,neutral
icev9c6,t1_icesnjr,6,3,1655263377.0,Equal-Echidna8098,There’s been 10 years of economic ‘boom’ allegedly after the war. Where did all that money go?,negative,neutral,neutral,neutral
icet98u,t1_icesnjr,5,3,1655262319.0,likerofgoodthings,It was ruined before that.,negative,neutral,neutral,neutral
iccekgl,t1_iccdmcb,7,3,1655223246.0,rastafarz,"Lol no, Rajiv Gandhi used the civil war and LTTE as an excuse to invade Sri Lanka in all but name and force his terms and conditions on it because JRs government was drifting toward the west instead. Rajiv Gandhis intervention to break the siege of Jaffna ensured the LTTE survived. Otherwise they would've been wiped out in 1987, not even 4 years after the conflict started. Prabhakaran was just incompetent and wanted more than Rajiv was willing to give, so he overestimated his ability and abandoned his Indian backers by having Gandhi killed.",negative,negative,negative,negative
iccffhh,t1_iccdmcb,0,3,1655223596.0,Communist_Antarctica,All Rajiv Ghandi's 'peace keeping' force did was shoot up the Jaffna Hospital and rape a bunch of girls,negative,negative,neutral,negative
