COMMENT_ID,COMMENT_PARENT_ID,COMMENT_SCORE,COMMENT_DEPTH,COMMENT_CREATED_TIMESTAMP,AUTHOR_USERNAME,COMMENT_TEXT_CONTENT,MODEL_LABEL_CARDIFFNLP,MODEL_LABEL_FINITEAUTOMATA,MODEL_LABEL_SEETHAL,MODEL_MAJORITY
icehhx2,t1_icec2wy,1,6,1655256380.0,bigzzz234,"Maybe cause I’m seeing through mobile app/notifications I legit don’t see half the stuff in your comments until I go back and check them. My bad

edit: Don't fucking lie though I'm 100% sure you added this later on. Atleast after I read it.

>I ASK AGAIN. Give me a direct quote (NOT YOUR SUBJECTIVE INTERPRETATION OF CHERRY PICKED 5 OUT OF CONTEXT WORDS) of me explicitely “defending a terrorists” in my og comment 😂

Shitcunt",negative,negative,neutral,negative
icfd925,t1_icec2wy,1,6,1655275206.0,bigzzz234,btw I wasn't strawmanning. I don't know why you keep mentioning that. Starting to feel like you were saying that just to dismiss my points lol. yikes,negative,neutral,neutral,neutral
icbr72d,t1_icbqo1x,3,6,1655212995.0,plasmasack,Wait what? I thought we were talking about who gota murdered,neutral,neutral,neutral,neutral
icchiid,t1_icbopus,2,6,1655224435.0,Communist_Antarctica,Why do y'all assume every Sinhalese person supported the Rajapaksas 2 years ago?,negative,neutral,neutral,neutral
icccum4,t1_iccba85,5,6,1655222543.0,rastafarz,"Facts and evidence are fantasies to you huh, stinker?  And you are in your own words, a [useless human being with no talent](https://www.reddit.com/r/wallstreetbets/comments/v6wpn4/jpow_juggling_the_economy_solving_it_in_real_time/ibijr2n/?context=3). You aren't smarter than anyone in this whole thread. You're the dumbest person here. All you can do is screech and cry when confronted with facts. Keep crying, it entertains us.",negative,negative,neutral,negative
iccczn3,t1_iccbhan,2,6,1655222601.0,rastafarz,">n-n-n-no y-y-y-ou

Did that make you feel real smart? Now clean up your shit.",negative,neutral,neutral,neutral
icce8u0,t1_icce2wh,1,6,1655223115.0,rastafarz,"Yes, that's what you just did.",neutral,neutral,neutral,neutral
iccb8bp,t1_iccay7d,2,6,1655221880.0,Larry_Potter_,"Slowly going insane I see, didn't mean to make you cry that hard",negative,neutral,neutral,neutral
icbrmek,t1_icbr72d,3,7,1655213207.0,likerofgoodthings,You said journalists were killed for kidnapping.,negative,negative,neutral,negative
iccd6jx,t1_icccum4,1,7,1655222681.0,navizier,"I'm smarter than you for sure. Aren't you entertained, stinker?",negative,neutral,neutral,neutral
iccdhg7,t1_iccczn3,3,7,1655222805.0,navizier,Fyi I've been feeling smart since I read your first comment. It was evident. I'm not surprised it took you so long to notice with your brain caught up with shit and shit.,negative,neutral,neutral,neutral
iccegdq,t1_icce8u0,2,7,1655223200.0,navizier,😂😂😂🤡🤡🤡😂😂😂,negative,neutral,neutral,neutral
iccbpa4,t1_iccb8bp,2,7,1655222073.0,navizier,If this is your way of consoling yourself then I feel sorry for you. You must learn better sarcasm.,negative,neutral,neutral,neutral
icbuhif,t1_icbrmek,3,8,1655214604.0,plasmasack,Where..? You asked who gota and mahindha murdered and I replied wit journalists,neutral,neutral,neutral,neutral
ictjzud,t1_icbrmek,1,8,1655550572.0,The_Merciless_Potato,"damn, you and u/navizier are both dumbasses huh?",negative,neutral,neutral,neutral
iccdn26,t1_iccd6jx,3,8,1655222870.0,rastafarz,"Nope, you aren't even smarter than a dog.",negative,negative,neutral,negative
iccdpnu,t1_iccdhg7,2,8,1655222899.0,rastafarz,"And the whole world feels smart when they see your posts. Now clean your fucking shit, you stink.",negative,negative,neutral,negative
iccbx2s,t1_iccbpa4,1,8,1655222164.0,Larry_Potter_,"Yeah distract yourself by giving life lessons, that would help with all the crying",neutral,neutral,neutral,neutral
icbvief,t1_icbuhif,2,9,1655215091.0,likerofgoodthings,When I asked why were the journalists killed.,negative,neutral,neutral,neutral
iccdrc4,t1_iccdn26,2,9,1655222918.0,,[removed],neutral,neutral,neutral,neutral
iccdya2,t1_iccdpnu,2,9,1655222996.0,navizier,"If shit talking had a face and definition, that would surely be you. Eating shit, that too.",negative,neutral,neutral,neutral
iccc3zg,t1_iccbx2s,2,9,1655222242.0,navizier,😂😂😂😂🤡🤡🤡😂😂😂😂,negative,neutral,neutral,neutral
iccc5cy,t1_iccbx2s,2,9,1655222257.0,navizier,😂😂😂🤡🤡🤡🤡🤡😂😂😂😂,negative,neutral,neutral,neutral
icbvxiw,t1_icbvief,5,1,1655215286.0,plasmasack,"Ah, when you said ""how come"" I thought you meant the method used to kill the journalists.

As for why they were killed, most probably because they were against their doings",negative,neutral,neutral,neutral
icce686,t1_iccdrc4,1,1,1655223086.0,,[removed],neutral,neutral,neutral,neutral
icce7bp,t1_iccdya2,2,1,1655223098.0,rastafarz,"Oi, clean your shit, stinker.",negative,neutral,neutral,neutral
icccd2i,t1_iccc5cy,1,1,1655222345.0,Larry_Potter_,">🤡

Posting your own face I see",neutral,neutral,neutral,neutral
icbwnw3,t1_icbvxiw,2,2,1655215627.0,likerofgoodthings,I thought how come meant why. What doings?,neutral,neutral,neutral,neutral
icceqwy,t1_icce686,2,2,1655223319.0,,[removed],neutral,neutral,neutral,neutral
icccgva,t1_icccd2i,2,2,1655222389.0,navizier,😂😂😂😂🤡🤡🤡🤡😂😂😂😂,negative,neutral,neutral,neutral
icbz1jd,t1_icbwnw3,3,3,1655216710.0,RiskierSubsetR,"Money laundering, murdering other journalists, war crimes etc.",negative,neutral,neutral,neutral
icch1by,t1_icbwnw3,1,3,1655224242.0,Communist_Antarctica,"Corruption, money laundering, pressuring the media, threatening journalists etc",negative,neutral,neutral,neutral
icccrox,t1_icccgva,1,3,1655222509.0,Larry_Potter_,">🤡

Nice face",positive,neutral,neutral,neutral
icchsl9,t1_icch1by,1,4,1655224546.0,likerofgoodthings,They have control over all media anyway right?,neutral,neutral,neutral,neutral
icccxsb,t1_icccrox,2,4,1655222580.0,navizier,You know I could write books about you. Larry Potter and his chamber of regrets. Larry Potter and his goblet of shitty comebacks 😂😂😂🤡🤡🤡😂😂😂,negative,neutral,neutral,neutral
icci169,t1_icchsl9,1,5,1655224643.0,rastafarz,Govt media and Derana orgs maybe. Better to say Derana has control over them actually. News1st and sunday leader and the like are independent still,neutral,neutral,neutral,neutral
iccd9tv,t1_icccxsb,1,5,1655222718.0,Larry_Potter_,"Please do,

Distract yourself, then maybe you can stop crying

Laugh emojis doesn't fool anyone buddy, we all know how frustrated you are",negative,neutral,negative,negative
iccdo9h,t1_iccd9tv,2,6,1655222883.0,navizier,Tell me. Do you work as a clown for a living? Or is it just to entertain people in reddit? 😂😂😂🤡🤡🤡😂😂😂,negative,neutral,neutral,neutral
icce22f,t1_iccdo9h,1,7,1655223039.0,Larry_Potter_,Are those the two things you do? Hahaha,neutral,neutral,neutral,neutral
icce9h3,t1_icce22f,2,8,1655223122.0,navizier,"Okay I'm getting tired of this. You aren't worthy of my time anymore, I'm bored. Your stupidity wins. Adios, kiddo.",negative,negative,neutral,negative
iccel2x,t1_icce9h3,1,9,1655223253.0,Larry_Potter_,"Oh no, I'm not worthy of holy dumbass's time.

Like anyone gives a shit LOL",negative,negative,neutral,negative
