COMMENT_ID,COMMENT_PARENT_ID,COMMENT_SCORE,COMMENT_DEPTH,COMMENT_CREATED_TIMESTAMP,AUTHOR_USERNAME,COMMENT_TEXT_CONTENT,MODEL_LABEL_CARDIFFNLP,MODEL_LABEL_FINITEAUTOMATA,MODEL_LABEL_SEETHAL,MODEL_MAJORITY
io0nefo,t3_xbp6mc,39,0,1662919764.0,udhayam2K,No one would have believed if someone has said that Srilanka is going to win the Asia cup! From under dogs to champions. Congrats.,positive,neutral,neutral,neutral
io2la9l,t3_xbp6mc,19,0,1662947776.0,Flat-War4343,"It was fantastic effort. Totally master piece. There are bunch of things our team has improved.
- keep the run rate going even wicket falls. In the past we have never seen that. 
- didn't pressurized after quick wickets fallen.
- instead of one or two man. All of batsmen contributed to the total. 
- super energy in the field.
- less mistake in the field. 
- using balling variations. Slow balls, clutters etc. 

Way to go boys way to go. Let's bring the WC. Congratulations !

Edit- another improvement.
-Good running between wickets. Got lots of quick singles. Which was lacking in our team for decades. 
 
Great stuff. ✌️",positive,positive,positive,positive
io0oiko,t3_xbp6mc,13,0,1662920156.0,Perdix_Icarus,Very well deserved victory!,positive,neutral,positive,positive
io14rg9,t3_xbp6mc,8,0,1662925990.0,blr32611,The big comeback they needed.,positive,neutral,neutral,neutral
io1np7d,t3_xbp6mc,9,0,1662932994.0,SuperSant,"Congratulations Folks !! Todays match shows how Sports creates such a level playing field where effort, passion and hard work always favors the best player / team !!",positive,neutral,positive,positive
io1ay2i,t3_xbp6mc,16,0,1662928193.0,moron1ctendency,"Pakistani here, you guys truly did a phenomenal comeback. The better team won in the end, congrats!",positive,positive,neutral,positive
io0tgmc,t3_xbp6mc,15,0,1662921948.0,Ombiaz,"Congratulations, from Pakistan! 👏 👏 👏",positive,positive,neutral,positive
io1q4q4,t3_xbp6mc,14,0,1662933963.0,Unused_Trash,"As a Pakistani I would like to say to our Sri Lankan friends. 

Congratulations Sri Lanka. Phenomenonal performance and dedication. You deserved that win. Hope we can learn from your team and get better as well.",positive,positive,neutral,positive
io0tcl3,t3_xbp6mc,13,0,1662921905.0,DissidentVarun,Congratulations Sri Lanka ....you showed the world what a great team is made of .. exceptional in all departments...also for winning the Asia net ball Championship...love from India,positive,positive,positive,positive
io0p1q0,t3_xbp6mc,10,0,1662920340.0,MRCOLT2,Congratulations from India,positive,neutral,neutral,neutral
io14r3k,t3_xbp6mc,5,0,1662925986.0,PicchiKaku,Congratulations,positive,neutral,neutral,neutral
io15rrs,t3_xbp6mc,9,0,1662926353.0,allthebadcommits,"Congrats guys, a very well-deserved win. Love from Pakistan",positive,positive,neutral,positive
io0vmok,t3_xbp6mc,7,0,1662922748.0,Responsible_Ad4144,"Jaya weva! 

Let’s win the economy now!",positive,neutral,neutral,neutral
io2wi3x,t3_xbp6mc,4,0,1662953253.0,Rare_Structure4827,"Congratulations Sri Lanka 🇱🇰.
I'm sure that we can come across  all the issues and let's build a happy country.",positive,positive,neutral,positive
io200su,t3_xbp6mc,6,0,1662938084.0,Great-Huckleberry777,"Congratulations Guys. Well deserved. What an amazing talent coming thru.

Love from Pakistan.",positive,positive,positive,positive
io2l9mp,t3_xbp6mc,3,0,1662947768.0,SRDcreations,congratulations!,positive,neutral,neutral,neutral
io3axst,t3_xbp6mc,2,0,1662962338.0,littlevase,Congratulations well played but it sadden me that our team lost.,negative,neutral,neutral,neutral
io3f3l7,t3_xbp6mc,2,0,1662965563.0,No-Salamander-8686,Congratulations from Pakistan,positive,neutral,neutral,neutral
io3hqi3,t3_xbp6mc,2,0,1662967772.0,bobs_and_vegana17,"congrats from india

no one had expected srilanka to win before the tournament but your boys proved everyone wrong

i hope pre 2015 era of lanka cricket is back",positive,positive,neutral,positive
io3p79d,t3_xbp6mc,2,0,1662974472.0,East_Ordinary8243,Congratulations to Srilankans from Pakistan. We love you.,positive,positive,positive,positive
io3t8r4,t3_xbp6mc,2,0,1662977928.0,dontknowwhyiamhere23,Congratulations SriLanka. Well played. You were the best team in the Asia Cup. Love from India.,positive,positive,positive,positive
io3y81o,t3_xbp6mc,2,0,1662981597.0,Defiant-Pirate-410,pakistani here. your team exposed a lot of our weaknesses. you guys dominated. fair play,positive,neutral,neutral,neutral
io44mq9,t3_xbp6mc,2,0,1662985482.0,,Absolutely smashed it. Congrats from Pakistan!,positive,positive,neutral,positive
io4gtjy,t3_xbp6mc,2,0,1662991373.0,Bilevi,"congratulations, honestly very happy to see your victory 🇵🇰🇱🇰",positive,positive,positive,positive
io4rrhp,t3_xbp6mc,2,0,1662995951.0,Osama_Rashid,"Congratulations, you guys played really well throughout the tournament (specially in the Super 4).",positive,positive,neutral,positive
io51lld,t3_xbp6mc,2,0,1662999860.0,Farazziraz,Pakistani here. My second favorite team to support in all cricket is SL.  I am so glad you guys won! Well deserved!  Such a great team SL has now and I’m really looking forward to their resurgence in the ODI and Test format as well!,positive,neutral,positive,positive
io5fafs,t3_xbp6mc,2,0,1663005225.0,SnooCalculations6718,Congrats Sri Lanka. This is coming from a pakistani,positive,neutral,neutral,neutral
io2o5c5,t3_xbp6mc,-5,0,1662949154.0,,"Congratulation  
https://www.youtube.com/channel/UC3p8D2\_GiHfjHCVbtSV6nuA?sub\_confirmation=1",neutral,positive,neutral,neutral
io3f60a,t3_xbp6mc,1,0,1662965617.0,IsleofSgail_21,"Not gonna lie, I thought we’ll mess up the final",negative,neutral,neutral,neutral
io4bqgc,t3_xbp6mc,1,0,1662989063.0,halfman1231,"We just call it Asia Cup.. but, yay!!",positive,neutral,neutral,neutral
io3foly,t1_io0nefo,5,1,1662966043.0,0rience,Bro you guys are 5 times now 6 times Asia cup winners.. you are giants not underdogs 💪💪,positive,neutral,neutral,neutral
io3c1zs,t1_io2la9l,6,1,1662963181.0,gifispronouncedgif,"The main takeaways from this tournament are Kusal Mendis' and Rajapakse's newfound form in t20is. Rajapakse averages like 70 this asia cup. He has a floating role, and is able to build an innings or slog at the death. He is the most vital batsmen in our team, because as this asia cup showed, if others fail he can still get it on, as his role overlaps with death powerhitters as well as top order accumulators. Moreover Kusal Mendis upping his strike rate as an opener is glorious and pairs really well with Nissanka's measured approach.

This new fearless cricket is what SL really needed, this is what SL have always been about since we started playing. 

Dds played some brilliant shots like friggin A\* drives, but im still not sure if he's the right man in the t20 wc in Aus with big boundaries. I want to see Asalanka back in form hopefully, since dds cant bowl spin overs in Aus.

Hasaranga was able to get wickets this match due to the run rate pressure, thats where he does best, when he's got a nice score to defend. My issue is that he hasnt been that good against the other sides. He needs to use his legspinner more often cos batsmen will just defend the googly otherwise.

Anyways I need not point out the good captaincy by Dasun Shanaka who's had to really learn a lot on the job. You can see his evolution from 2021 wc to nowadays, he's far more mature. He was always willing to learn and adapt and I said back then he'd be one of our best captains cos of this. His batting will be key as well, of course.",positive,positive,positive,positive
io3b7ic,t1_io1ay2i,6,1,1662962539.0,gifispronouncedgif,"bro im so happy it was Pak vs SL final, we are really friendly, if we lost also it wont be that bad cos Pakbros, and I think the same applies the other way around. Hope pakistan can sort out the middle order issues.",positive,neutral,positive,positive
io321lh,t1_io0tgmc,8,1,1662956384.0,brownmanta,Thanks for the sportsmanship you guys showed today. ❤️,positive,positive,neutral,positive
io3kx70,t1_io3b7ic,5,2,1662970601.0,moron1ctendency,"Definitely, I don't think there's any other team we'd rather lose to.

Man, we just need Babar back in form and Fakhar to be gone, I'm guessing we're going to bring in Shan Masood next.",neutral,neutral,neutral,neutral
